{
  "title": "Vaak samen met een trouwfotograaf aangevraagd",
  "subject_line": "Trouwfotograaf gevonden? Dit boeken stellen erbij",
  "preheader": "Videograaf, DJ, catering en weddingplanner: vaak samen met een trouwfotograaf aangevraagd.",
  "campaign_key": "crosssell_trouwfotograaf_mail1",
  "hero_image_url": "https://img.mailinblue.com/9986607/images/rnb/original/6a99ca94acfba11dfcf1878b.jpg",
  "hero_image_alt": "Trouwfotograaf aan het werk: bruidspaar spontaan fotograferen",
  "hero_eyebrow": "Na je aanvraag voor een trouwfotograaf",
  "hero_title_pre": "Maak jullie",
  "hero_title_accent": "bruiloft",
  "hero_title_post": "compleet",
  "hero_subtitle": "Je zocht onlangs via Trustoo een trouwfotograaf. De fotograaf is vaak één van de eerste boekingen. Video, muziek, eten en planning volgen.",
  "list_heading_pre": "Maak jullie",
  "list_heading_accent": "bruiloft",
  "list_heading_post": "compleet",
  "list_intro": "Een bruiloft regel je met een klein team van leveranciers. Deze diensten boeken stellen vaak samen. Vergelijk beoordelingen en ontvang gratis een prijsindicatie.",
  "card1_url": "https://trustoo.nl/nederland/videograaf/?utm_source=brevo&utm_campaign=crosssell_trouwfotograaf_mail1&utm_medium=email&utm_content=videograafcard",
  "card1_image_url": "https://img.mailinblue.com/9986607/images/rnb/original/6a99ca99be55c06bad68f882.jpg",
  "card1_image_alt": "Videograaf aan het werk: professionele camera bedienen",
  "card1_label": "Feest & event",
  "card1_name": "Videografen",
  "card1_text": "Leg de sfeer van je dag vast in beeld en geluid, van de eerste toost tot de laatste dans op de vloer.",
  "card1_link_label": "Ontvang prijsindicatie",
  "card2_url": "https://trustoo.nl/nederland/dj/?utm_source=brevo&utm_campaign=crosssell_trouwfotograaf_mail1&utm_medium=email&utm_content=djcard",
  "card2_image_url": "https://img.mailinblue.com/9986607/images/rnb/original/6a99ca6125aaba004d88df8c.jpg",
  "card2_image_alt": "DJ aan het werk: draaitafel en apparatuur bedienen",
  "card2_label": "Feest & event",
  "card2_name": "DJ's",
  "card2_text": "Een DJ leest de zaal en houdt de dansvloer vol, met muziek die past bij jouw gasten en jouw feest.",
  "card2_link_label": "Ontvang prijsindicatie",
  "card3_url": "https://trustoo.nl/nederland/catering/?utm_source=brevo&utm_campaign=crosssell_trouwfotograaf_mail1&utm_medium=email&utm_content=cateringcard",
  "card3_image_url": "https://img.mailinblue.com/9986607/images/rnb/original/6a99ca5fb423db7c1ead99af.jpg",
  "card3_image_alt": "Cateraar aan het werk: gerechten voorbereiden voor evenement",
  "card3_label": "Feest & event",
  "card3_name": "Cateraars",
  "card3_text": "Van hapjes tot buffet: een cateraar regelt eten en drinken, zodat jij alle aandacht hebt voor je gasten.",
  "card3_link_label": "Ontvang prijsindicatie",
  "card4_url": "https://trustoo.nl/nederland/weddingplanner/?utm_source=brevo&utm_campaign=crosssell_trouwfotograaf_mail1&utm_medium=email&utm_content=weddingplannercard",
  "card4_image_url": "https://img.mailinblue.com/9986607/images/rnb/original/6a99ca9db423db7c1ead99bf.jpg",
  "card4_image_alt": "Weddingplanner aan het werk: tafeldecoratie en draaiboek controleren",
  "card4_label": "Feest & event",
  "card4_name": "Weddingplanners",
  "card4_text": "Een weddingplanner bewaakt planning, leveranciers en budget, zodat jij van de dag kunt genieten.",
  "card4_link_label": "Ontvang prijsindicatie",
  "closing_heading_pre": "Iets anders",
  "closing_heading_accent": "nodig?",
  "closing_heading_post": "",
  "closing_intro": "Op Trustoo vind je vakmensen voor bijna elke klus in en om het huis, en voor zakelijke en persoonlijke hulp. Vergelijk beoordelingen en ontvang gratis een prijsindicatie.",
  "all_services_url": "https://trustoo.nl/alle-diensten/?utm_source=brevo&utm_campaign=crosssell_trouwfotograaf_mail1&utm_medium=email&utm_content=allediensten",
  "all_services_label": "Alle diensten bekijken",
  "dashboard_label": "Mijn aanvragen"
}
