{
  "title": "Vaak samen met een schilder aangevraagd",
  "subject_line": "Wat mensen naast een schilder vaak ook regelen",
  "preheader": "Stukadoors, schoonmaakbedrijven, verhuisfirma's en vloerders: vraag alvast een gratis prijsindicatie op voor uw opfrisbeurt.",
  "campaign_key": "crosssell_schilder_mail1",
  "hero_image_url": "https://img.mailinblue.com/9986607/images/rnb/original/6aaa43aa0b0c510d795d8951.jpg",
  "hero_image_alt": "Schilder aan het werk: binnenmuur schilderen met een verfroller",
  "hero_eyebrow": "Na uw aanvraag voor een schilder",
  "hero_title_pre": "Verf houdt langer op een",
  "hero_title_accent": "strakke",
  "hero_title_post": "ondergrond",
  "hero_subtitle": "U zocht onlangs via Trustlocal een schilder. Schilderwerk hoort vaak bij een grotere opfrisbeurt: strakke muren, een nieuwe vloer of een verhuizing.",
  "list_heading_pre": "Zo wordt schilderwerk",
  "list_heading_accent": "echt",
  "list_heading_post": "af",
  "list_intro": "Een opfrisbeurt stopt zelden bij één klus. Deze vakmensen schakelen mensen vaak in rond hetzelfde project. Vergelijk beoordelingen en ontvang gratis een prijsindicatie.",
  "card1_url": "https://trustlocal.be/belgie/stukadoor/?utm_source=brevo&utm_campaign=crosssell_schilder_mail1&utm_medium=email&utm_content=stukadoorcard",
  "card1_image_url": "https://img.mailinblue.com/9986607/images/rnb/original/6a99ca8db423db7c1ead99ba.jpg",
  "card1_image_alt": "Stukadoor aan het werk: wand glad pleisteren",
  "card1_label": "Afwerking",
  "card1_name": "Stukadoors",
  "card1_text": "Strakke muren en plafonds zijn de basis voor verf of behang. Laat het pleisterwerk vooraf goed doen.",
  "card1_link_label": "Ontvang prijsindicatie",
  "card2_url": "https://trustlocal.be/belgie/schoonmaakbedrijf/?utm_source=brevo&utm_campaign=crosssell_schilder_mail1&utm_medium=email&utm_content=schoonmaakbedrijfcard",
  "card2_image_url": "https://img.mailinblue.com/9986607/images/rnb/original/6a99ca84d6d15096d2e48ab9.jpg",
  "card2_image_alt": "Professionele schoonmaker aan het werk: keukenoppervlak grondig reinigen",
  "card2_label": "Schoon & onderhoud",
  "card2_name": "Schoonmaakbedrijven",
  "card2_text": "Laat uw woning grondig schoonmaken na de klus of voor de oplevering. Ook voor periodiek onderhoud.",
  "card2_link_label": "Ontvang prijsindicatie",
  "card3_url": "https://trustlocal.be/belgie/verhuisfirma/?utm_source=brevo&utm_campaign=crosssell_schilder_mail1&utm_medium=email&utm_content=verhuisfirmacard",
  "card3_image_url": "https://img.mailinblue.com/9986607/images/rnb/original/6a99ca96d6d15096d2e48abb.jpg",
  "card3_image_alt": "Medewerker van een verhuisfirma aan het werk: verhuisdoos zorgvuldig naar bus dragen",
  "card3_label": "Verhuizen",
  "card3_name": "Verhuisfirma's",
  "card3_text": "Laat inpakken, vervoeren en dragen uit handen nemen, zodat de verhuisdag rustig verloopt.",
  "card3_link_label": "Ontvang prijsindicatie",
  "card4_url": "https://trustlocal.be/belgie/vloerder/?utm_source=brevo&utm_campaign=crosssell_schilder_mail1&utm_medium=email&utm_content=vloerdercard",
  "card4_image_url": "https://img.mailinblue.com/9986607/images/rnb/original/6a99ca9a25aaba004d88dfa3.jpg",
  "card4_image_alt": "Vloerder aan het werk: houten vloerplanken leggen",
  "card4_label": "Afwerking",
  "card4_name": "Vloerders",
  "card4_text": "Een nieuwe vloer maakt de ruimte af. Laat hem strak leggen door een vakman, van laminaat tot pvc.",
  "card4_link_label": "Ontvang prijsindicatie",
  "closing_heading_pre": "Iets anders",
  "closing_heading_accent": "nodig?",
  "closing_heading_post": "",
  "closing_intro": "Op Trustlocal vindt u vakmensen voor bijna elke klus in en om het huis, en voor zakelijke en persoonlijke hulp. Vergelijk beoordelingen en ontvang gratis een prijsindicatie.",
  "all_services_url": "https://trustlocal.be/alle-diensten/?utm_source=brevo&utm_campaign=crosssell_schilder_mail1&utm_medium=email&utm_content=allediensten",
  "all_services_label": "Alle diensten bekijken",
  "dashboard_label": "Mijn aanvragen"
}
