{
  "title": "Vaak samen met een interieurstylist aangevraagd",
  "subject_line": "Wat mensen naast een interieurstylist vaak ook regelen",
  "preheader": "Stoffeerders, meubelmakers, schilders en vloerleggers: vraag alvast een gratis prijsindicatie op voor je opfrisbeurt.",
  "campaign_key": "crosssell_interieurstylist_mail1",
  "hero_image_url": "https://img.mailinblue.com/9986607/images/rnb/original/6a99ca76b423db7c1ead99b3.jpg",
  "hero_image_alt": "Interieurstylist aan het werk: materialen en kleuren presenteren",
  "hero_eyebrow": "Na je aanvraag voor een interieurstylist",
  "hero_title_pre": "Van",
  "hero_title_accent": "interieurplan",
  "hero_title_post": "naar uitvoering",
  "hero_subtitle": "Je zocht onlangs via Trustoo een interieurstylist. Een interieurplan komt tot leven met stoffering, maatwerk meubels, verf en een nieuwe vloer.",
  "list_heading_pre": "Je woning",
  "list_heading_accent": "opfrissen",
  "list_heading_post": "tot in de details",
  "list_intro": "Een opfrisbeurt stopt zelden bij één klus. Deze vakmensen schakelen mensen vaak in rond hetzelfde project. Vergelijk beoordelingen en ontvang gratis een prijsindicatie.",
  "card1_url": "https://trustoo.nl/nederland/stoffeerder/?utm_source=brevo&utm_campaign=crosssell_interieurstylist_mail1&utm_medium=email&utm_content=stoffeerdercard",
  "card1_image_url": "https://img.mailinblue.com/9986607/images/rnb/original/6a99ca8c25aaba004d88df9a.jpg",
  "card1_image_alt": "Stoffeerder aan het werk: stoel opnieuw bekleden",
  "card1_label": "Interieur",
  "card1_name": "Stoffeerders",
  "card1_text": "Trapbekleding, vloerbedekking of meubels opnieuw bekleden. Maatwerk dat je interieur helemaal afmaakt.",
  "card1_link_label": "Ontvang prijsindicatie",
  "card2_url": "https://trustoo.nl/nederland/meubelmaker/?utm_source=brevo&utm_campaign=crosssell_interieurstylist_mail1&utm_medium=email&utm_content=meubelmakercard",
  "card2_image_url": "https://img.mailinblue.com/9986607/images/rnb/original/6a99ca7fb423db7c1ead99b6.jpg",
  "card2_image_alt": "Meubelmaker aan het werk: houten meubel afwerken",
  "card2_label": "Interieur",
  "card2_name": "Meubelmakers",
  "card2_text": "Een kast, tafel of inbouwmeubel op maat, precies passend in jouw ruimte en jouw interieur.",
  "card2_link_label": "Ontvang prijsindicatie",
  "card3_url": "https://trustoo.nl/nederland/schilder/?utm_source=brevo&utm_campaign=crosssell_interieurstylist_mail1&utm_medium=email&utm_content=schildercard",
  "card3_image_url": "https://img.mailinblue.com/9986607/images/rnb/original/6aaa43aa0b0c510d795d8951.jpg",
  "card3_image_alt": "Schilder aan het werk: binnenmuur schilderen met een verfroller",
  "card3_label": "Afwerking",
  "card3_name": "Schilders",
  "card3_text": "Een frisse laag verf binnen of buiten. Een schilder zorgt voor strak werk en een duurzame afwerking.",
  "card3_link_label": "Ontvang prijsindicatie",
  "card4_url": "https://trustoo.nl/nederland/vloerlegger/?utm_source=brevo&utm_campaign=crosssell_interieurstylist_mail1&utm_medium=email&utm_content=vloerleggercard",
  "card4_image_url": "https://img.mailinblue.com/9986607/images/rnb/original/6a99ca9a25aaba004d88dfa3.jpg",
  "card4_image_alt": "Vloerlegger aan het werk: houten vloerplanken leggen",
  "card4_label": "Afwerking",
  "card4_name": "Vloerleggers",
  "card4_text": "Een nieuwe vloer maakt de ruimte af. Laat hem strak leggen door een vakman, van laminaat tot pvc.",
  "card4_link_label": "Ontvang prijsindicatie",
  "closing_heading_pre": "Iets anders",
  "closing_heading_accent": "nodig?",
  "closing_heading_post": "",
  "closing_intro": "Op Trustoo vind je vakmensen voor bijna elke klus in en om het huis, en voor zakelijke en persoonlijke hulp. Vergelijk beoordelingen en ontvang gratis een prijsindicatie.",
  "all_services_url": "https://trustoo.nl/alle-diensten/?utm_source=brevo&utm_campaign=crosssell_interieurstylist_mail1&utm_medium=email&utm_content=allediensten",
  "all_services_label": "Alle diensten bekijken",
  "dashboard_label": "Mijn aanvragen"
}
