{
  "title": "Vaak samen met een cv-installateur aangevraagd",
  "subject_line": "Wat mensen naast een cv-installateur vaak ook regelen",
  "preheader": "Loodgieters, warmtepompinstallateurs, isolatiebedrijven en elektriciens: vraag alvast een gratis prijsindicatie op voor je verduurzaming.",
  "campaign_key": "crosssell_cv_installateur_mail1",
  "hero_image_url": "https://img.mailinblue.com/9986607/images/rnb/original/6a99ca5ebe55c06bad68f871.jpg",
  "hero_image_alt": "cv-installateur aan het werk: cV-ketel installeren",
  "hero_eyebrow": "Na je aanvraag voor een cv-installateur",
  "hero_title_pre": "Nieuwe ketel? Kijk meteen naar wat je",
  "hero_title_accent": "bespaart",
  "hero_title_post": "",
  "hero_subtitle": "Je zocht onlangs via Trustoo een cv-installateur. Een nieuwe ketel of onderhoud is een goed moment om ook naar isolatie en een warmtepomp te kijken.",
  "list_heading_pre": "Isolatie en warmtepomp",
  "list_heading_accent": "naast",
  "list_heading_post": "je cv",
  "list_intro": "Verduurzamen gaat stap voor stap, en veel stappen versterken elkaar. Deze diensten vroegen anderen vaak aan in dezelfde periode. Vergelijk beoordelingen en ontvang gratis een prijsindicatie.",
  "card1_url": "https://trustoo.nl/nederland/loodgieter/?utm_source=brevo&utm_campaign=crosssell_cv_installateur_mail1&utm_medium=email&utm_content=loodgietercard",
  "card1_image_url": "https://img.mailinblue.com/9986607/images/rnb/original/6a99ca7aacfba11dfcf18786.jpg",
  "card1_image_alt": "Loodgieter aan het werk: leidingen aansluiten onder wastafel",
  "card1_label": "Installatie",
  "card1_name": "Loodgieters",
  "card1_text": "Voor leidingen, afvoer en sanitair. Handig bij een verbouwing of als er iets lekt of verstopt zit.",
  "card1_link_label": "Ontvang prijsindicatie",
  "card2_url": "https://trustoo.nl/nederland/warmtepomp-installateur/?utm_source=brevo&utm_campaign=crosssell_cv_installateur_mail1&utm_medium=email&utm_content=warmtepompinstallateurcard",
  "card2_image_url": "https://img.mailinblue.com/9986607/images/rnb/original/6a99ca9cb423db7c1ead99be.jpg",
  "card2_image_alt": "Warmtepompinstallateur aan het werk: warmtepomp aansluiten",
  "card2_label": "Energie",
  "card2_name": "Warmtepompinstallateurs",
  "card2_text": "Verwarm je huis zonder gas. Laat berekenen welke warmtepomp bij je woning past en wat het oplevert.",
  "card2_link_label": "Ontvang prijsindicatie",
  "card3_url": "https://trustoo.nl/nederland/isolatie/?utm_source=brevo&utm_campaign=crosssell_cv_installateur_mail1&utm_medium=email&utm_content=isolatiecard",
  "card3_image_url": "https://img.mailinblue.com/9986607/images/rnb/original/6a99ca7725aaba004d88df92.jpg",
  "card3_image_alt": "Isolatiespecialist aan het werk: isolatiemateriaal aanbrengen",
  "card3_label": "Energie",
  "card3_name": "Isolatiebedrijven",
  "card3_text": "Isoleer dak, muren of vloer en bespaar direct op je energierekening. Vaak met subsidie mogelijk.",
  "card3_link_label": "Ontvang prijsindicatie",
  "card4_url": "https://trustoo.nl/nederland/elektricien/?utm_source=brevo&utm_campaign=crosssell_cv_installateur_mail1&utm_medium=email&utm_content=elektriciencard",
  "card4_image_url": "https://img.mailinblue.com/9986607/images/rnb/original/6a99ca6525aaba004d88df8d.jpg",
  "card4_image_alt": "Elektricien aan het werk: stopcontact of groepenkast aansluiten",
  "card4_label": "Installatie",
  "card4_name": "Elektriciens",
  "card4_text": "Extra groepen, stopcontacten of verlichting: laat het veilig aanleggen en keuren door een vakman.",
  "card4_link_label": "Ontvang prijsindicatie",
  "closing_heading_pre": "Iets anders",
  "closing_heading_accent": "nodig?",
  "closing_heading_post": "",
  "closing_intro": "Op Trustoo vind je vakmensen voor bijna elke klus in en om het huis, en voor zakelijke en persoonlijke hulp. Vergelijk beoordelingen en ontvang gratis een prijsindicatie.",
  "all_services_url": "https://trustoo.nl/alle-diensten/?utm_source=brevo&utm_campaign=crosssell_cv_installateur_mail1&utm_medium=email&utm_content=allediensten",
  "all_services_label": "Alle diensten bekijken",
  "dashboard_label": "Mijn aanvragen"
}
