{
  "title": "Vaak samen met een stukadoor aangevraagd",
  "subject_line": "Wat mensen naast een stukadoor vaak ook regelen",
  "preheader": "Schilders, aannemers, elektriciens en vloerders: vraag alvast een gratis prijsindicatie op voor uw opfrisbeurt.",
  "campaign_key": "crosssell_stukadoor_mail1",
  "hero_image_url": "https://img.mailinblue.com/9986607/images/rnb/original/6a99ca8db423db7c1ead99ba.jpg",
  "hero_image_alt": "Stukadoor aan het werk: wand glad pleisteren",
  "hero_eyebrow": "Na uw aanvraag voor een stukadoor",
  "hero_title_pre": "Strakke muren verdienen een",
  "hero_title_accent": "strakke",
  "hero_title_post": "afwerking",
  "hero_subtitle": "U zocht onlangs via Trustlocal een stukadoor. Pleisterwerk is meestal de basis. Daarna volgen verf, elektriciteit en een nieuwe vloer.",
  "list_heading_pre": "Verf, elektriciteit en vloer",
  "list_heading_accent": "na",
  "list_heading_post": "het pleisterwerk",
  "list_intro": "Een opfrisbeurt stopt zelden bij één klus. Deze vakmensen schakelen mensen vaak in rond hetzelfde project. Vergelijk beoordelingen en ontvang gratis een prijsindicatie.",
  "card1_url": "https://trustlocal.be/belgie/schilder/?utm_source=brevo&utm_campaign=crosssell_stukadoor_mail1&utm_medium=email&utm_content=schildercard",
  "card1_image_url": "https://img.mailinblue.com/9986607/images/rnb/original/6aaa43aa0b0c510d795d8951.jpg",
  "card1_image_alt": "Schilder aan het werk: binnenmuur schilderen met een verfroller",
  "card1_label": "Afwerking",
  "card1_name": "Schilders",
  "card1_text": "Een frisse laag verf binnen of buiten. Een schilder zorgt voor strak werk en een duurzame afwerking.",
  "card1_link_label": "Ontvang prijsindicatie",
  "card2_url": "https://trustlocal.be/belgie/aannemer/?utm_source=brevo&utm_campaign=crosssell_stukadoor_mail1&utm_medium=email&utm_content=aannemercard",
  "card2_image_url": "https://img.mailinblue.com/9986607/images/rnb/original/6a99ca53be55c06bad68f86a.jpg",
  "card2_image_alt": "Aannemer aan het werk: bouwtekening bekijken tijdens renovatie",
  "card2_label": "Verbouwen",
  "card2_name": "Aannemers",
  "card2_text": "Voor grotere klussen met meerdere vakmensen. Een aannemer plant, regelt en houdt het overzicht.",
  "card2_link_label": "Ontvang prijsindicatie",
  "card3_url": "https://trustlocal.be/belgie/elektricien/?utm_source=brevo&utm_campaign=crosssell_stukadoor_mail1&utm_medium=email&utm_content=elektriciencard",
  "card3_image_url": "https://img.mailinblue.com/9986607/images/rnb/original/6a99ca6525aaba004d88df8d.jpg",
  "card3_image_alt": "Elektricien aan het werk: stopcontact of zekeringkast aansluiten",
  "card3_label": "Installatie",
  "card3_name": "Elektriciens",
  "card3_text": "Extra stroomkringen, stopcontacten of verlichting: laat het veilig aanleggen en keuren door een vakman.",
  "card3_link_label": "Ontvang prijsindicatie",
  "card4_url": "https://trustlocal.be/belgie/vloerder/?utm_source=brevo&utm_campaign=crosssell_stukadoor_mail1&utm_medium=email&utm_content=vloerdercard",
  "card4_image_url": "https://img.mailinblue.com/9986607/images/rnb/original/6a99ca9a25aaba004d88dfa3.jpg",
  "card4_image_alt": "Vloerder aan het werk: houten vloerplanken leggen",
  "card4_label": "Afwerking",
  "card4_name": "Vloerders",
  "card4_text": "Een nieuwe vloer maakt de ruimte af. Laat hem strak leggen door een vakman, van laminaat tot pvc.",
  "card4_link_label": "Ontvang prijsindicatie",
  "closing_heading_pre": "Iets anders",
  "closing_heading_accent": "nodig?",
  "closing_heading_post": "",
  "closing_intro": "Op Trustlocal vindt u vakmensen voor bijna elke klus in en om het huis, en voor zakelijke en persoonlijke hulp. Vergelijk beoordelingen en ontvang gratis een prijsindicatie.",
  "all_services_url": "https://trustlocal.be/alle-diensten/?utm_source=brevo&utm_campaign=crosssell_stukadoor_mail1&utm_medium=email&utm_content=allediensten",
  "all_services_label": "Alle diensten bekijken",
  "dashboard_label": "Mijn aanvragen"
}
