{
  "title": "Vaak samen met een warmtepompinstallateur aangevraagd",
  "subject_line": "Wat mensen naast een warmtepompinstallateur vaak ook regelen",
  "preheader": "Isolatiebedrijven, chauffagisten, elektriciens en zonnepaneleninstallateurs: vraag alvast een gratis prijsindicatie op voor uw energierenovatie.",
  "campaign_key": "crosssell_warmtepomp-installateur_mail1",
  "hero_image_url": "https://img.mailinblue.com/9986607/images/rnb/original/6a99ca9cb423db7c1ead99be.jpg",
  "hero_image_alt": "Warmtepompinstallateur aan het werk: warmtepomp aansluiten",
  "hero_eyebrow": "Na uw aanvraag voor een warmtepompinstallateur",
  "hero_title_pre": "Een warmtepomp presteert pas in een",
  "hero_title_accent": "goed geïsoleerd",
  "hero_title_post": "huis",
  "hero_subtitle": "U zocht onlangs via Trustlocal een warmtepompinstallateur. Een warmtepomp werkt het best in een goed geïsoleerd huis met voldoende stroom.",
  "list_heading_pre": "Isolatie, elektriciteit en zonnepanelen",
  "list_heading_accent": "rond",
  "list_heading_post": "uw warmtepomp",
  "list_intro": "Energiezuiniger maken gaat stap voor stap, en veel stappen versterken elkaar. Deze diensten vroegen anderen vaak aan in dezelfde periode. Vergelijk beoordelingen en ontvang gratis een prijsindicatie.",
  "card1_url": "https://trustlocal.be/belgie/isolatie/?utm_source=brevo&utm_campaign=crosssell_warmtepomp-installateur_mail1&utm_medium=email&utm_content=isolatiecard",
  "card1_image_url": "https://img.mailinblue.com/9986607/images/rnb/original/6a99ca7725aaba004d88df92.jpg",
  "card1_image_alt": "Isolatiespecialist aan het werk: isolatiemateriaal aanbrengen",
  "card1_label": "Energie",
  "card1_name": "Isolatiebedrijven",
  "card1_text": "Isoleer dak, muren of vloer en bespaar direct op uw energiefactuur. Vaak met premie mogelijk.",
  "card1_link_label": "Ontvang prijsindicatie",
  "card2_url": "https://trustlocal.be/belgie/chauffagist/?utm_source=brevo&utm_campaign=crosssell_warmtepomp-installateur_mail1&utm_medium=email&utm_content=chauffagistcard",
  "card2_image_url": "https://img.mailinblue.com/9986607/images/rnb/original/6a99ca5ebe55c06bad68f871.jpg",
  "card2_image_alt": "Chauffagist aan het werk: verwarmingsketel installeren",
  "card2_label": "Installatie",
  "card2_name": "Chauffagisten",
  "card2_text": "Ketel vervangen, onderhoud of radiatoren erbij: houd uw verwarming betrouwbaar, veilig en zuinig.",
  "card2_link_label": "Ontvang prijsindicatie",
  "card3_url": "https://trustlocal.be/belgie/elektricien/?utm_source=brevo&utm_campaign=crosssell_warmtepomp-installateur_mail1&utm_medium=email&utm_content=elektriciencard",
  "card3_image_url": "https://img.mailinblue.com/9986607/images/rnb/original/6a99ca6525aaba004d88df8d.jpg",
  "card3_image_alt": "Elektricien aan het werk: stopcontact of zekeringkast aansluiten",
  "card3_label": "Installatie",
  "card3_name": "Elektriciens",
  "card3_text": "Extra stroomkringen, stopcontacten of verlichting: laat het veilig aanleggen en keuren door een vakman.",
  "card3_link_label": "Ontvang prijsindicatie",
  "card4_url": "https://trustlocal.be/belgie/zonnepanelen/?utm_source=brevo&utm_campaign=crosssell_warmtepomp-installateur_mail1&utm_medium=email&utm_content=zonnepanelencard",
  "card4_image_url": "https://img.mailinblue.com/9986607/images/rnb/original/6a99ca9fb423db7c1ead99c1.jpg",
  "card4_image_alt": "Zonnepaneleninstallateur aan het werk: zonnepaneel op dak monteren",
  "card4_label": "Energie",
  "card4_name": "Zonnepaneleninstallateurs",
  "card4_text": "Wek uw eigen stroom op en verlaag uw energiefactuur. Laat berekenen wat uw dak kan opleveren.",
  "card4_link_label": "Ontvang prijsindicatie",
  "closing_heading_pre": "Iets anders",
  "closing_heading_accent": "nodig?",
  "closing_heading_post": "",
  "closing_intro": "Op Trustlocal vindt u vakmensen voor bijna elke klus in en om het huis, en voor zakelijke en persoonlijke hulp. Vergelijk beoordelingen en ontvang gratis een prijsindicatie.",
  "all_services_url": "https://trustlocal.be/alle-diensten/?utm_source=brevo&utm_campaign=crosssell_warmtepomp-installateur_mail1&utm_medium=email&utm_content=allediensten",
  "all_services_label": "Alle diensten bekijken",
  "dashboard_label": "Mijn aanvragen"
}
