{
  "title": "Vaak samen met een asbestverwijderaar aangevraagd",
  "subject_line": "Asbest gesaneerd? Dit komt er vaak na",
  "preheader": "Sloopbedrijf, aannemer, bouwkundige keuring en timmerman: vaak samen met asbestwerk aangevraagd.",
  "campaign_key": "crosssell_asbest_mail1",
  "hero_image_url": "https://img.mailinblue.com/9986607/images/rnb/original/6a99ca57d6d15096d2e48aaf.jpg",
  "hero_image_alt": "Asbestsaneerder aan het werk: asbestmateriaal veilig verwijderen",
  "hero_eyebrow": "Na je aanvraag voor een asbestverwijderaar",
  "hero_title_pre": "Veilig",
  "hero_title_accent": "verbouwen",
  "hero_title_post": "na de sanering",
  "hero_subtitle": "Je zocht onlangs via Trustoo een asbestverwijderaar. Na een asbestsanering kan de verbouwing beginnen: slopen, bouwen en keuren.",
  "list_heading_pre": "Maak je",
  "list_heading_accent": "verbouwing",
  "list_heading_post": "compleet",
  "list_intro": "Bij een verbouwing komen vaak meerdere vakmensen samen. Deze diensten vroegen anderen via Trustoo vaak aan rond dezelfde klus. Vergelijk beoordelingen en vraag gratis offertes aan.",
  "card1_url": "https://trustoo.nl/nederland/sloopbedrijf/?utm_source=brevo&utm_campaign=crosssell_asbest_mail1&utm_medium=email&utm_content=sloopbedrijfcard",
  "card1_image_url": "https://img.mailinblue.com/9986607/images/rnb/original/6a99ca8bacfba11dfcf18789.jpg",
  "card1_image_alt": "Sloopwerker aan het werk: binnenmuur gecontroleerd verwijderen",
  "card1_label": "Verbouwen",
  "card1_name": "Sloopbedrijven",
  "card1_text": "Muur eruit of oude keuken weg? Een sloopbedrijf werkt veilig en voert het sloopafval netjes af.",
  "card1_link_label": "Vergelijk offertes",
  "card2_url": "https://trustoo.nl/nederland/aannemer/?utm_source=brevo&utm_campaign=crosssell_asbest_mail1&utm_medium=email&utm_content=aannemercard",
  "card2_image_url": "https://img.mailinblue.com/9986607/images/rnb/original/6a99ca53be55c06bad68f86a.jpg",
  "card2_image_alt": "Aannemer aan het werk: bouwtekening bekijken tijdens renovatie",
  "card2_label": "Verbouwen",
  "card2_name": "Aannemers",
  "card2_text": "Voor grotere klussen waarbij meerdere vakmensen samenkomen. Een aannemer plant, regelt en coördineert.",
  "card2_link_label": "Vergelijk offertes",
  "card3_url": "https://trustoo.nl/nederland/bouwkundige-keuring/?utm_source=brevo&utm_campaign=crosssell_asbest_mail1&utm_medium=email&utm_content=bouwkundigekeuringcard",
  "card3_image_url": "https://img.mailinblue.com/9986607/images/rnb/original/6a99ca5ed6d15096d2e48ab2.jpg",
  "card3_image_alt": "Bouwkundig inspecteur aan het werk: muur en kozijn inspecteren",
  "card3_label": "Wonen",
  "card3_name": "Bouwkundig keurders",
  "card3_text": "Weet wat je koopt of waar je aan toe bent: een keuring brengt gebreken en kosten vooraf in beeld.",
  "card3_link_label": "Vergelijk offertes",
  "card4_url": "https://trustoo.nl/nederland/timmerman/?utm_source=brevo&utm_campaign=crosssell_asbest_mail1&utm_medium=email&utm_content=timmermancard",
  "card4_image_url": "https://img.mailinblue.com/9986607/images/rnb/original/6a99ca9025aaba004d88df9d.jpg",
  "card4_image_alt": "Timmerman aan het werk: houten constructie op maat maken",
  "card4_label": "Verbouwen",
  "card4_name": "Timmermannen",
  "card4_text": "Voor maatwerk in hout: kasten, kozijnen, vloeren en constructiewerk, netjes op maat gemaakt.",
  "card4_link_label": "Vergelijk offertes",
  "closing_heading_pre": "Iets anders",
  "closing_heading_accent": "nodig?",
  "closing_heading_post": "",
  "closing_intro": "Op Trustoo vind je vakmensen voor bijna elke klus in en om het huis, en voor zakelijke en persoonlijke hulp. Vergelijk beoordelingen en vraag gratis offertes aan.",
  "all_services_url": "https://trustoo.nl/alle-diensten/?utm_source=brevo&utm_campaign=crosssell_asbest_mail1&utm_medium=email&utm_content=allediensten",
  "all_services_label": "Alle diensten bekijken",
  "dashboard_label": "Mijn aanvragen"
}
