{
  "title": "Vaak samen met een vochtbestrijder aangevraagd",
  "subject_line": "Vochtprobleem aangepakt? Dit laten anderen nakijken",
  "preheader": "Loodgieter, isolatie, bouwkundige keuring en riool: vaak samen met vochtbestrijding aangevraagd.",
  "campaign_key": "crosssell_vochtbestrijding_mail1",
  "hero_image_url": "https://img.mailinblue.com/9986607/images/rnb/original/6a99ca9bbe55c06bad68f884.jpg",
  "hero_image_alt": "Vochtbestrijder aan het werk: vochtmeting uitvoeren op muur",
  "hero_eyebrow": "Na je aanvraag voor een vochtbestrijder",
  "hero_title_pre": "Je huis weer",
  "hero_title_accent": "droog",
  "hero_title_post": "en gezond",
  "hero_subtitle": "Je zocht onlangs via Trustoo een vochtbestrijder. Vochtproblemen hebben vaak meerdere oorzaken. Leidingen, isolatie en riolering worden er vaak bij nagekeken.",
  "list_heading_pre": "Je huis",
  "list_heading_accent": "gezond en droog",
  "list_heading_post": "houden",
  "list_intro": "Vocht, ongedierte en verstoppingen hebben vaak dezelfde oorzaak. Deze vakmensen schakelen anderen vaak samen in. Vergelijk beoordelingen en ontvang gratis een prijsindicatie.",
  "card1_url": "https://trustoo.nl/nederland/loodgieter/?utm_source=brevo&utm_campaign=crosssell_vochtbestrijding_mail1&utm_medium=email&utm_content=loodgietercard",
  "card1_image_url": "https://img.mailinblue.com/9986607/images/rnb/original/6a99ca7aacfba11dfcf18786.jpg",
  "card1_image_alt": "Loodgieter aan het werk: leidingen aansluiten onder wastafel",
  "card1_label": "Installatie",
  "card1_name": "Loodgieters",
  "card1_text": "Voor leidingen, afvoer en sanitair. Handig bij een verbouwing of als er iets lekt of verstopt zit.",
  "card1_link_label": "Ontvang prijsindicatie",
  "card2_url": "https://trustoo.nl/nederland/isolatie/?utm_source=brevo&utm_campaign=crosssell_vochtbestrijding_mail1&utm_medium=email&utm_content=isolatiecard",
  "card2_image_url": "https://img.mailinblue.com/9986607/images/rnb/original/6a99ca7725aaba004d88df92.jpg",
  "card2_image_alt": "Isolatiespecialist aan het werk: isolatiemateriaal aanbrengen",
  "card2_label": "Energie",
  "card2_name": "Isolatiebedrijven",
  "card2_text": "Isoleer dak, muren of vloer en bespaar direct op je energierekening. Vaak met subsidie mogelijk.",
  "card2_link_label": "Ontvang prijsindicatie",
  "card3_url": "https://trustoo.nl/nederland/bouwkundige-keuring/?utm_source=brevo&utm_campaign=crosssell_vochtbestrijding_mail1&utm_medium=email&utm_content=bouwkundigekeuringcard",
  "card3_image_url": "https://img.mailinblue.com/9986607/images/rnb/original/6a99ca5ed6d15096d2e48ab2.jpg",
  "card3_image_alt": "Bouwkundig inspecteur aan het werk: muur en kozijn inspecteren",
  "card3_label": "Wonen",
  "card3_name": "Bouwkundig keurders",
  "card3_text": "Weet wat je koopt of waar je aan toe bent: een keuring brengt gebreken en kosten vooraf in beeld.",
  "card3_link_label": "Ontvang prijsindicatie",
  "card4_url": "https://trustoo.nl/nederland/rioolservice/?utm_source=brevo&utm_campaign=crosssell_vochtbestrijding_mail1&utm_medium=email&utm_content=rioolservicecard",
  "card4_image_url": "https://img.mailinblue.com/9986607/images/rnb/original/6a99ca8825aaba004d88df97.jpg",
  "card4_image_alt": "Rioolspecialist aan het werk: afvoer inspecteren met camera-apparatuur",
  "card4_label": "Schoon & onderhoud",
  "card4_name": "Rioolspecialisten",
  "card4_text": "Verstopping, stank of lekkage? Een rioolspecialist inspecteert met een camera en lost het op.",
  "card4_link_label": "Ontvang prijsindicatie",
  "closing_heading_pre": "Iets anders",
  "closing_heading_accent": "nodig?",
  "closing_heading_post": "",
  "closing_intro": "Op Trustoo vind je vakmensen voor bijna elke klus in en om het huis, en voor zakelijke en persoonlijke hulp. Vergelijk beoordelingen en ontvang gratis een prijsindicatie.",
  "all_services_url": "https://trustoo.nl/alle-diensten/?utm_source=brevo&utm_campaign=crosssell_vochtbestrijding_mail1&utm_medium=email&utm_content=allediensten",
  "all_services_label": "Alle diensten bekijken",
  "dashboard_label": "Mijn aanvragen"
}
