{
  "title": "Vaak samen met een coach aangevraagd",
  "subject_line": "Begeleiding die kan aansluiten bij coaching",
  "preheader": "Psychologen, personal trainers, diëtisten en loopbaancoaches: hulp die anderen soms ernaast kiezen, alleen als het bij je past.",
  "campaign_key": "crosssell_coaching_mail1",
  "hero_image_url": "https://img.mailinblue.com/9986607/images/rnb/original/6aaa43adba6d538d2bee14c9.jpg",
  "hero_image_alt": "Coach aan het werk: gesprek over persoonlijke en professionele doelen",
  "hero_eyebrow": "Na je aanvraag voor een coach",
  "hero_title_pre": "Werken aan",
  "hero_title_accent": "jezelf",
  "hero_title_post": "op meer vlakken",
  "hero_subtitle": "Je zocht onlangs via Trustoo een coach. Coaching is één manier om verder te komen. Hoofd, lijf en werk versterken elkaar; soms kiezen mensen daar aanvullende begeleiding bij.",
  "list_heading_pre": "Hulp die bij je",
  "list_heading_accent": "past",
  "list_heading_post": "",
  "list_intro": "Hulp zoeken heeft veel kanten: hoofd, lijf en werk. Deze professionals kiezen anderen soms ernaast, alleen als het past. Vergelijk beoordelingen en neem vrijblijvend contact op.",
  "card1_url": "https://trustoo.nl/nederland/psycholoog/?utm_source=brevo&utm_campaign=crosssell_coaching_mail1&utm_medium=email&utm_content=psycholoogcard",
  "card1_image_url": "https://img.mailinblue.com/9986607/images/rnb/original/6a99ca85be55c06bad68f87e.jpg",
  "card1_image_alt": "Psycholoog aan het werk: rustig gesprek voeren met cliënt",
  "card1_label": "Welzijn",
  "card1_name": "Psychologen",
  "card1_text": "Praat met een professional als je vastloopt of meer grip wilt op hoe je je voelt. In je eigen tempo.",
  "card1_link_label": "Bekijk mogelijkheden",
  "card2_url": "https://trustoo.nl/nederland/personal-trainer/?utm_source=brevo&utm_campaign=crosssell_coaching_mail1&utm_medium=email&utm_content=personaltrainercard",
  "card2_image_url": "https://img.mailinblue.com/9986607/images/rnb/original/6aaa43affd8ef40f6e584547.jpg",
  "card2_image_alt": "Personal trainer aan het werk: klant begeleiden bij krachttraining",
  "card2_label": "Welzijn",
  "card2_name": "Personal trainers",
  "card2_text": "Werk gericht aan je conditie en kracht, met een schema en begeleiding die passen bij jouw doelen.",
  "card2_link_label": "Bekijk mogelijkheden",
  "card3_url": "https://trustoo.nl/nederland/dietist/?utm_source=brevo&utm_campaign=crosssell_coaching_mail1&utm_medium=email&utm_content=dietistcard",
  "card3_image_url": "https://img.mailinblue.com/9986607/images/rnb/original/6aaa43afba6d538d2bee14ca.jpg",
  "card3_image_alt": "Diëtist aan het werk: voedingsadvies geven aan een cliënt",
  "card3_label": "Welzijn",
  "card3_name": "Diëtisten",
  "card3_text": "Eet beter met advies dat past bij jouw lijf en leven, zonder ingewikkelde regels of strenge diëten.",
  "card3_link_label": "Bekijk mogelijkheden",
  "card4_url": "https://trustoo.nl/nederland/loopbaancoach/?utm_source=brevo&utm_campaign=crosssell_coaching_mail1&utm_medium=email&utm_content=loopbaancoachcard",
  "card4_image_url": "https://img.mailinblue.com/9986607/images/rnb/original/6a99ca7bbe55c06bad68f87a.jpg",
  "card4_image_alt": "Loopbaancoach aan het werk: loopbaandoelen bespreken",
  "card4_label": "Welzijn",
  "card4_name": "Loopbaancoaches",
  "card4_text": "Twijfel over je werk? Een loopbaancoach helpt je ontdekken wat bij je past en welke stap je zet.",
  "card4_link_label": "Bekijk mogelijkheden",
  "closing_heading_pre": "Iets anders",
  "closing_heading_accent": "nodig?",
  "closing_heading_post": "",
  "closing_intro": "Op Trustoo vind je vakmensen voor bijna elke klus in en om het huis, en voor zakelijke en persoonlijke hulp. Vergelijk beoordelingen en ontvang gratis een prijsindicatie.",
  "all_services_url": "https://trustoo.nl/alle-diensten/?utm_source=brevo&utm_campaign=crosssell_coaching_mail1&utm_medium=email&utm_content=allediensten",
  "all_services_label": "Alle diensten bekijken",
  "dashboard_label": "Mijn aanvragen"
}
