{
  "title": "Vaak samen met een klusjesman aangevraagd",
  "subject_line": "Wat mensen naast een klusjesman vaak ook regelen",
  "preheader": "Schilders, loodgieters, elektriciens en meubelmakers: vraag alvast een gratis prijsindicatie op voor je opfrisbeurt.",
  "campaign_key": "crosssell_klusjesman_mail1",
  "hero_image_url": "https://img.mailinblue.com/9986607/images/rnb/original/6a99ca7825aaba004d88df93.jpg",
  "hero_image_alt": "Klusjesman aan het werk: kast of plank monteren",
  "hero_eyebrow": "Na je aanvraag voor een klusjesman",
  "hero_title_pre": "Klussen geregeld, en",
  "hero_title_accent": "dan",
  "hero_title_post": "de grotere klussen",
  "hero_subtitle": "Je zocht onlangs via Trustoo een klusjesman. Kleine klussen zijn vaak het begin. Voor schilderwerk, leidingen, elektra en maatwerk zoek je een specialist.",
  "list_heading_pre": "Je woning",
  "list_heading_accent": "opfrissen",
  "list_heading_post": "tot in de details",
  "list_intro": "Een opfrisbeurt stopt zelden bij één klus. Deze vakmensen schakelen mensen vaak in rond hetzelfde project. Vergelijk beoordelingen en ontvang gratis een prijsindicatie.",
  "card1_url": "https://trustoo.nl/nederland/schilder/?utm_source=brevo&utm_campaign=crosssell_klusjesman_mail1&utm_medium=email&utm_content=schildercard",
  "card1_image_url": "https://img.mailinblue.com/9986607/images/rnb/original/6aaa43aa0b0c510d795d8951.jpg",
  "card1_image_alt": "Schilder aan het werk: binnenmuur schilderen met een verfroller",
  "card1_label": "Afwerking",
  "card1_name": "Schilders",
  "card1_text": "Een frisse laag verf binnen of buiten. Een schilder zorgt voor strak werk en een duurzame afwerking.",
  "card1_link_label": "Ontvang prijsindicatie",
  "card2_url": "https://trustoo.nl/nederland/loodgieter/?utm_source=brevo&utm_campaign=crosssell_klusjesman_mail1&utm_medium=email&utm_content=loodgietercard",
  "card2_image_url": "https://img.mailinblue.com/9986607/images/rnb/original/6a99ca7aacfba11dfcf18786.jpg",
  "card2_image_alt": "Loodgieter aan het werk: leidingen aansluiten onder wastafel",
  "card2_label": "Installatie",
  "card2_name": "Loodgieters",
  "card2_text": "Voor leidingen, afvoer en sanitair. Handig bij een verbouwing of als er iets lekt of verstopt zit.",
  "card2_link_label": "Ontvang prijsindicatie",
  "card3_url": "https://trustoo.nl/nederland/elektricien/?utm_source=brevo&utm_campaign=crosssell_klusjesman_mail1&utm_medium=email&utm_content=elektriciencard",
  "card3_image_url": "https://img.mailinblue.com/9986607/images/rnb/original/6a99ca6525aaba004d88df8d.jpg",
  "card3_image_alt": "Elektricien aan het werk: stopcontact of groepenkast aansluiten",
  "card3_label": "Installatie",
  "card3_name": "Elektriciens",
  "card3_text": "Extra groepen, stopcontacten of verlichting: laat het veilig aanleggen en keuren door een vakman.",
  "card3_link_label": "Ontvang prijsindicatie",
  "card4_url": "https://trustoo.nl/nederland/meubelmaker/?utm_source=brevo&utm_campaign=crosssell_klusjesman_mail1&utm_medium=email&utm_content=meubelmakercard",
  "card4_image_url": "https://img.mailinblue.com/9986607/images/rnb/original/6a99ca7fb423db7c1ead99b6.jpg",
  "card4_image_alt": "Meubelmaker aan het werk: houten meubel afwerken",
  "card4_label": "Interieur",
  "card4_name": "Meubelmakers",
  "card4_text": "Een kast, tafel of inbouwmeubel op maat, precies passend in jouw ruimte en jouw interieur.",
  "card4_link_label": "Ontvang prijsindicatie",
  "closing_heading_pre": "Iets anders",
  "closing_heading_accent": "nodig?",
  "closing_heading_post": "",
  "closing_intro": "Op Trustoo vind je vakmensen voor bijna elke klus in en om het huis, en voor zakelijke en persoonlijke hulp. Vergelijk beoordelingen en ontvang gratis een prijsindicatie.",
  "all_services_url": "https://trustoo.nl/alle-diensten/?utm_source=brevo&utm_campaign=crosssell_klusjesman_mail1&utm_medium=email&utm_content=allediensten",
  "all_services_label": "Alle diensten bekijken",
  "dashboard_label": "Mijn aanvragen"
}
