{
  "title": "Vaak samen met een EPC-keurder aangevraagd",
  "subject_line": "Wat mensen naast een EPC-keurder vaak ook regelen",
  "preheader": "Isolatiebedrijven, vastgoedmakelaars, warmtepompinstallateurs en zonnepaneleninstallateurs: vraag alvast een gratis prijsindicatie op.",
  "campaign_key": "crosssell_epc-keuring_mail1",
  "hero_image_url": "https://img.mailinblue.com/9986607/images/rnb/original/6a99ca6625aaba004d88df8e.jpg",
  "hero_image_alt": "EPC-keurder aan het werk: isolatie en raam controleren",
  "hero_eyebrow": "Na uw aanvraag voor een EPC-keurder",
  "hero_title_pre": "Een EPC laat zien waar de",
  "hero_title_accent": "winst",
  "hero_title_post": "zit in uw woning",
  "hero_subtitle": "U zocht onlangs via Trustlocal een EPC-keurder. Een EPC laat zien waar winst zit. Isolatie, warmtepomp en zonnepanelen zijn vaak de volgende stap.",
  "list_heading_pre": "Misschien ook",
  "list_heading_accent": "handig",
  "list_heading_post": "voor u",
  "list_intro": "Deze diensten kunnen aansluiten bij uw aanvraag. Vergelijk beoordelingen en ontvang gratis een prijsindicatie.",
  "card1_url": "https://trustlocal.be/belgie/isolatie/?utm_source=brevo&utm_campaign=crosssell_epc-keuring_mail1&utm_medium=email&utm_content=isolatiecard",
  "card1_image_url": "https://img.mailinblue.com/9986607/images/rnb/original/6a99ca7725aaba004d88df92.jpg",
  "card1_image_alt": "Isolatiespecialist aan het werk: isolatiemateriaal aanbrengen",
  "card1_label": "Energie",
  "card1_name": "Isolatiebedrijven",
  "card1_text": "Isoleer dak, muren of vloer en bespaar direct op uw energiefactuur. Vaak met premie mogelijk.",
  "card1_link_label": "Ontvang prijsindicatie",
  "card2_url": "https://trustlocal.be/belgie/vastgoedmakelaar/?utm_source=brevo&utm_campaign=crosssell_epc-keuring_mail1&utm_medium=email&utm_content=vastgoedmakelaarcard",
  "card2_image_url": "https://img.mailinblue.com/9986607/images/rnb/original/6a99ca7cd6d15096d2e48ab7.jpg",
  "card2_image_alt": "Vastgoedmakelaar aan het werk: woning rondleiden aan geïnteresseerden",
  "card2_label": "Wonen",
  "card2_name": "Vastgoedmakelaars",
  "card2_text": "Koopt of verkoopt u een woning? Een vastgoedmakelaar kent de markt en regelt bezichtiging en onderhandeling.",
  "card2_link_label": "Ontvang prijsindicatie",
  "card3_url": "https://trustlocal.be/belgie/warmtepomp-installateur/?utm_source=brevo&utm_campaign=crosssell_epc-keuring_mail1&utm_medium=email&utm_content=warmtepomp-installateurcard",
  "card3_image_url": "https://img.mailinblue.com/9986607/images/rnb/original/6a99ca9cb423db7c1ead99be.jpg",
  "card3_image_alt": "Warmtepompinstallateur aan het werk: warmtepomp aansluiten",
  "card3_label": "Energie",
  "card3_name": "Warmtepompinstallateurs",
  "card3_text": "Verwarm uw huis zonder gas. Laat berekenen welke warmtepomp bij uw woning past en wat het oplevert.",
  "card3_link_label": "Ontvang prijsindicatie",
  "card4_url": "https://trustlocal.be/belgie/zonnepanelen/?utm_source=brevo&utm_campaign=crosssell_epc-keuring_mail1&utm_medium=email&utm_content=zonnepanelencard",
  "card4_image_url": "https://img.mailinblue.com/9986607/images/rnb/original/6a99ca9fb423db7c1ead99c1.jpg",
  "card4_image_alt": "Zonnepaneleninstallateur aan het werk: zonnepaneel op dak monteren",
  "card4_label": "Energie",
  "card4_name": "Zonnepaneleninstallateurs",
  "card4_text": "Wek uw eigen stroom op en verlaag uw energiefactuur. Laat berekenen wat uw dak kan opleveren.",
  "card4_link_label": "Ontvang prijsindicatie",
  "closing_heading_pre": "Iets anders",
  "closing_heading_accent": "nodig?",
  "closing_heading_post": "",
  "closing_intro": "Op Trustlocal vindt u vakmensen voor bijna elke klus in en om het huis, en voor zakelijke en persoonlijke hulp. Vergelijk beoordelingen en ontvang gratis een prijsindicatie.",
  "all_services_url": "https://trustlocal.be/alle-diensten/?utm_source=brevo&utm_campaign=crosssell_epc-keuring_mail1&utm_medium=email&utm_content=allediensten",
  "all_services_label": "Alle diensten bekijken",
  "dashboard_label": "Mijn aanvragen"
}
