{
  "title": "Vaak samen met een online marketing bureau aangevraagd",
  "subject_line": "Wat mensen naast een online marketing bureau vaak ook regelen",
  "preheader": "SEO-specialisten, webdesigners, tekstschrijvers en grafisch ontwerpers: vraag alvast een gratis prijsindicatie op voor je bedrijf.",
  "campaign_key": "crosssell_online_marketing_mail1",
  "hero_image_url": "https://img.mailinblue.com/9986607/images/content_library/original/69fdbabdc0930e7c615624c1.png",
  "hero_image_alt": "Online marketeer aan het werk",
  "hero_eyebrow": "Na je aanvraag voor een online marketing bureau",
  "hero_title_pre": "Bereik is niks zonder een site die",
  "hero_title_accent": "converteert",
  "hero_title_post": "",
  "hero_subtitle": "Je zocht onlangs via Trustoo een online marketing bureau. Online marketing werkt het best met een goede website, sterke teksten en een herkenbaar ontwerp.",
  "list_heading_pre": "Website, teksten en ontwerp",
  "list_heading_accent": "achter",
  "list_heading_post": "je campagnes",
  "list_intro": "Een sterke online aanwezigheid bouw je met meerdere specialisten. Deze diensten vroegen anderen vaak samen aan. Vergelijk beoordelingen en ontvang gratis een prijsindicatie.",
  "card1_url": "https://trustoo.nl/nederland/seo-specialist/?utm_source=brevo&utm_campaign=crosssell_online_marketing_mail1&utm_medium=email&utm_content=seospecialistcard",
  "card1_image_url": "https://img.mailinblue.com/9986607/images/content_library/original/69fdbabd23da2f84ec11733c.png",
  "card1_image_alt": "SEO-specialist analyseert data",
  "card1_label": "Marketing",
  "card1_name": "SEO-specialisten",
  "card1_text": "Sta hoger in Google met een website die technisch en inhoudelijk goed in elkaar zit en blijft groeien.",
  "card1_link_label": "Ontvang prijsindicatie",
  "card2_url": "https://trustoo.nl/nederland/webdesign/?utm_source=brevo&utm_campaign=crosssell_online_marketing_mail1&utm_medium=email&utm_content=webdesigncard",
  "card2_image_url": "https://img.mailinblue.com/9986607/images/rnb/original/6a99ca9dbe55c06bad68f885.jpg",
  "card2_image_alt": "Webdesigner aan het werk: website-interface ontwerpen",
  "card2_label": "Marketing",
  "card2_name": "Webdesigners",
  "card2_text": "Een website die er goed uitziet en werkt op elk scherm. Het online visitekaartje van je bedrijf.",
  "card2_link_label": "Ontvang prijsindicatie",
  "card3_url": "https://trustoo.nl/nederland/tekstschrijver/?utm_source=brevo&utm_campaign=crosssell_online_marketing_mail1&utm_medium=email&utm_content=tekstschrijvercard",
  "card3_image_url": "https://img.mailinblue.com/9986607/images/rnb/original/6a99ca8facfba11dfcf1878a.jpg",
  "card3_image_alt": "Tekstschrijver aan het werk: tekst redigeren aan laptop",
  "card3_label": "Marketing",
  "card3_name": "Tekstschrijvers",
  "card3_text": "Sterke teksten voor je website, brochure of nieuwsbrief, die je verhaal helder en overtuigend vertellen.",
  "card3_link_label": "Ontvang prijsindicatie",
  "card4_url": "https://trustoo.nl/nederland/grafisch-ontwerper/?utm_source=brevo&utm_campaign=crosssell_online_marketing_mail1&utm_medium=email&utm_content=grafischontwerpercard",
  "card4_image_url": "https://img.mailinblue.com/9986607/images/content_library/original/69fdbabe23da2f84ec11733d.png",
  "card4_image_alt": "Grafisch ontwerper aan het werk",
  "card4_label": "Marketing",
  "card4_name": "Grafisch ontwerpers",
  "card4_text": "Een herkenbaar logo en huisstijl maken je bedrijf professioneel, online en op papier. Van idee tot ontwerp.",
  "card4_link_label": "Ontvang prijsindicatie",
  "closing_heading_pre": "Iets anders",
  "closing_heading_accent": "nodig?",
  "closing_heading_post": "",
  "closing_intro": "Op Trustoo vind je vakmensen voor bijna elke klus in en om het huis, en voor zakelijke en persoonlijke hulp. Vergelijk beoordelingen en ontvang gratis een prijsindicatie.",
  "all_services_url": "https://trustoo.nl/alle-diensten/?utm_source=brevo&utm_campaign=crosssell_online_marketing_mail1&utm_medium=email&utm_content=allediensten",
  "all_services_label": "Alle diensten bekijken",
  "dashboard_label": "Mijn aanvragen"
}
