{
  "title": "Ook via Trustlocal te regelen",
  "subject_line": "Van vakantieplannen naar woonplannen",
  "preheader": "Zonnepaneleninstallateurs, schilders, vastgoedmakelaars en fotografen: vergelijk professionals en vraag gratis een prijsindicatie op.",
  "campaign_key": "crosssell_reisbureau_mail1",
  "hero_image_url": "",
  "hero_image_alt": "",
  "hero_eyebrow": "Na uw aanvraag voor een reisbureau",
  "hero_title_pre": "Ook voor uw",
  "hero_title_accent": "volgende",
  "hero_title_post": "plannen vindt u hier professionals",
  "hero_subtitle": "U zocht onlangs via Trustlocal een reisbureau. Op Trustlocal vindt u ook professionals voor uw woning of een feest: van zonnepanelen tot fotograaf.",
  "list_heading_pre": "Ook",
  "list_heading_accent": "handig",
  "list_heading_post": "via Trustlocal",
  "list_intro": "Vergelijk professionals bij u in de buurt, lees beoordelingen en ontvang gratis een prijsindicatie.",
  "card1_url": "https://trustlocal.be/belgie/zonnepanelen/?utm_source=brevo&utm_campaign=crosssell_reisbureau_mail1&utm_medium=email&utm_content=zonnepanelencard",
  "card1_image_url": "https://img.mailinblue.com/9986607/images/rnb/original/6a99ca9fb423db7c1ead99c1.jpg",
  "card1_image_alt": "Zonnepaneleninstallateur aan het werk: zonnepaneel op dak monteren",
  "card1_label": "Energie",
  "card1_name": "Zonnepaneleninstallateurs",
  "card1_text": "Wek uw eigen stroom op en verlaag uw energiefactuur. Laat berekenen wat uw dak kan opleveren.",
  "card1_link_label": "Ontvang prijsindicatie",
  "card2_url": "https://trustlocal.be/belgie/schilder/?utm_source=brevo&utm_campaign=crosssell_reisbureau_mail1&utm_medium=email&utm_content=schildercard",
  "card2_image_url": "https://img.mailinblue.com/9986607/images/rnb/original/6aaa43aa0b0c510d795d8951.jpg",
  "card2_image_alt": "Schilder aan het werk: binnenmuur schilderen met een verfroller",
  "card2_label": "Afwerking",
  "card2_name": "Schilders",
  "card2_text": "Een frisse laag verf binnen of buiten. Een schilder zorgt voor strak werk en een duurzame afwerking.",
  "card2_link_label": "Ontvang prijsindicatie",
  "card3_url": "https://trustlocal.be/belgie/vastgoedmakelaar/?utm_source=brevo&utm_campaign=crosssell_reisbureau_mail1&utm_medium=email&utm_content=vastgoedmakelaarcard",
  "card3_image_url": "https://img.mailinblue.com/9986607/images/rnb/original/6a99ca7cd6d15096d2e48ab7.jpg",
  "card3_image_alt": "Vastgoedmakelaar aan het werk: woning rondleiden aan geïnteresseerden",
  "card3_label": "Wonen",
  "card3_name": "Vastgoedmakelaars",
  "card3_text": "Koopt of verkoopt u een woning? Een vastgoedmakelaar kent de markt en regelt bezichtiging en onderhandeling.",
  "card3_link_label": "Ontvang prijsindicatie",
  "card4_url": "https://trustlocal.be/belgie/fotograaf/?utm_source=brevo&utm_campaign=crosssell_reisbureau_mail1&utm_medium=email&utm_content=fotograafcard",
  "card4_image_url": "https://img.mailinblue.com/9986607/images/rnb/original/6aaa43b0fd8ef40f6e584548.jpg",
  "card4_image_alt": "Fotograaf aan het werk: familieshoot in de studio",
  "card4_label": "Feest & event",
  "card4_name": "Fotografen",
  "card4_text": "Een fotograaf legt de mooiste momenten vast, zodat u er later nog vaak en met plezier naar terugkijkt.",
  "card4_link_label": "Ontvang prijsindicatie",
  "closing_heading_pre": "Iets anders",
  "closing_heading_accent": "nodig?",
  "closing_heading_post": "",
  "closing_intro": "Op Trustlocal vindt u professionals voor bijna elke klus in en om het huis, en voor zakelijke en persoonlijke hulp. Vergelijk beoordelingen en ontvang gratis een prijsindicatie.",
  "all_services_url": "https://trustlocal.be/alle-diensten/?utm_source=brevo&utm_campaign=crosssell_reisbureau_mail1&utm_medium=email&utm_content=allediensten",
  "all_services_label": "Alle diensten bekijken",
  "dashboard_label": "Mijn aanvragen"
}
