{
  "title": "Vaak samen met een architect aangevraagd",
  "subject_line": "Wat mensen naast een architect vaak ook regelen",
  "preheader": "Aannemers, schrijnwerkers, keukenbouwers en EPC-keurders: vraag alvast een gratis prijsindicatie op.",
  "campaign_key": "crosssell_architect_mail1",
  "hero_image_url": "https://img.mailinblue.com/9986607/images/rnb/original/6a99ca56be55c06bad68f86c.jpg",
  "hero_image_alt": "Architect aan het werk: bouwtekeningen bespreken op locatie",
  "hero_eyebrow": "Na uw aanvraag voor een architect",
  "hero_title_pre": "Een goed ontwerp verdient een goede",
  "hero_title_accent": "uitvoering",
  "hero_title_post": "",
  "hero_subtitle": "U zocht onlangs via Trustlocal een architect. Voor de uitvoering van uw ontwerp kunnen een aannemer, schrijnwerker, keukenbouwer en EPC-keurder aansluiten.",
  "list_heading_pre": "Misschien ook",
  "list_heading_accent": "handig",
  "list_heading_post": "voor u",
  "list_intro": "Deze diensten kunnen aansluiten bij uw aanvraag. Vergelijk beoordelingen en ontvang gratis een prijsindicatie.",
  "card1_url": "https://trustlocal.be/belgie/aannemer/?utm_source=brevo&utm_campaign=crosssell_architect_mail1&utm_medium=email&utm_content=aannemercard",
  "card1_image_url": "https://img.mailinblue.com/9986607/images/rnb/original/6a99ca53be55c06bad68f86a.jpg",
  "card1_image_alt": "Aannemer aan het werk: bouwtekening bekijken tijdens renovatie",
  "card1_label": "Verbouwen",
  "card1_name": "Aannemers",
  "card1_text": "Voor grotere klussen met meerdere vakmensen. Een aannemer plant, regelt en houdt het overzicht.",
  "card1_link_label": "Ontvang prijsindicatie",
  "card2_url": "https://trustlocal.be/belgie/schrijnwerker/?utm_source=brevo&utm_campaign=crosssell_architect_mail1&utm_medium=email&utm_content=schrijnwerkercard",
  "card2_image_url": "https://img.mailinblue.com/9986607/images/rnb/original/6a99ca9025aaba004d88df9d.jpg",
  "card2_image_alt": "Schrijnwerker aan het werk: houten constructie op maat maken",
  "card2_label": "Verbouwen",
  "card2_name": "Schrijnwerkers",
  "card2_text": "Voor maatwerk in hout: kasten, ramen, vloeren en constructiewerk, netjes op maat gemaakt.",
  "card2_link_label": "Ontvang prijsindicatie",
  "card3_url": "https://trustlocal.be/belgie/keukenbouwer/?utm_source=brevo&utm_campaign=crosssell_architect_mail1&utm_medium=email&utm_content=keukenbouwercard",
  "card3_image_url": "https://img.mailinblue.com/9986607/images/rnb/original/6aaa43a80b0c510d795d8950.jpg",
  "card3_image_alt": "Keukenbouwer aan het werk: keukenontwerp bespreken met een klant",
  "card3_label": "Verbouwen",
  "card3_name": "Keukenbouwers",
  "card3_text": "Nieuwe keuken of uw huidige keuken opknappen? Van ontwerp tot montage geregeld door een specialist.",
  "card3_link_label": "Ontvang prijsindicatie",
  "card4_url": "https://trustlocal.be/belgie/epc-keuring/?utm_source=brevo&utm_campaign=crosssell_architect_mail1&utm_medium=email&utm_content=epc-keuringcard",
  "card4_image_url": "https://img.mailinblue.com/9986607/images/rnb/original/6a99ca6625aaba004d88df8e.jpg",
  "card4_image_alt": "EPC-keurder aan het werk: isolatie en raam controleren",
  "card4_label": "Energie",
  "card4_name": "EPC-keurders",
  "card4_text": "Laat een EPC opmaken voor verkoop of verhuur en ontdek hoe u uw woning energiezuiniger maakt.",
  "card4_link_label": "Ontvang prijsindicatie",
  "closing_heading_pre": "Iets anders",
  "closing_heading_accent": "nodig?",
  "closing_heading_post": "",
  "closing_intro": "Op Trustlocal vindt u vakmensen voor bijna elke klus in en om het huis, en voor zakelijke en persoonlijke hulp. Vergelijk beoordelingen en ontvang gratis een prijsindicatie.",
  "all_services_url": "https://trustlocal.be/alle-diensten/?utm_source=brevo&utm_campaign=crosssell_architect_mail1&utm_medium=email&utm_content=allediensten",
  "all_services_label": "Alle diensten bekijken",
  "dashboard_label": "Mijn aanvragen"
}
