{
  "title": "Vaak samen met een elektricien aangevraagd",
  "subject_line": "Wat mensen naast een elektricien vaak ook regelen",
  "preheader": "Loodgieters, aannemers, keukenspecialisten en badkamerspecialisten: vraag alvast een gratis prijsindicatie op voor je verbouwing.",
  "campaign_key": "crosssell_elektricien_mail1",
  "hero_image_url": "https://img.mailinblue.com/9986607/images/rnb/original/6a99ca6525aaba004d88df8d.jpg",
  "hero_image_alt": "Elektricien aan het werk: stopcontact of groepenkast aansluiten",
  "hero_eyebrow": "Na je aanvraag voor een elektricien",
  "hero_title_pre": "Stroom geregeld, en",
  "hero_title_accent": "dan",
  "hero_title_post": "verder",
  "hero_subtitle": "Je zocht onlangs via Trustoo een elektricien. Elektra komt zelden alleen. Leidingwerk, een aannemer of een nieuwe keuken of badkamer horen er vaak bij.",
  "list_heading_pre": "Maak je",
  "list_heading_accent": "verbouwing",
  "list_heading_post": "compleet",
  "list_intro": "Bij een verbouwing komen vaak meerdere vakmensen samen. Deze diensten vroegen anderen via Trustoo vaak aan rond dezelfde klus. Vergelijk beoordelingen en ontvang gratis een prijsindicatie.",
  "card1_url": "https://trustoo.nl/nederland/loodgieter/?utm_source=brevo&utm_campaign=crosssell_elektricien_mail1&utm_medium=email&utm_content=loodgietercard",
  "card1_image_url": "https://img.mailinblue.com/9986607/images/rnb/original/6a99ca7aacfba11dfcf18786.jpg",
  "card1_image_alt": "Loodgieter aan het werk: leidingen aansluiten onder wastafel",
  "card1_label": "Installatie",
  "card1_name": "Loodgieters",
  "card1_text": "Voor leidingen, afvoer en sanitair. Handig bij een verbouwing of als er iets lekt of verstopt zit.",
  "card1_link_label": "Ontvang prijsindicatie",
  "card2_url": "https://trustoo.nl/nederland/aannemer/?utm_source=brevo&utm_campaign=crosssell_elektricien_mail1&utm_medium=email&utm_content=aannemercard",
  "card2_image_url": "https://img.mailinblue.com/9986607/images/rnb/original/6a99ca53be55c06bad68f86a.jpg",
  "card2_image_alt": "Aannemer aan het werk: bouwtekening bekijken tijdens renovatie",
  "card2_label": "Verbouwen",
  "card2_name": "Aannemers",
  "card2_text": "Voor grotere klussen met meerdere vakmensen. Een aannemer plant, regelt en houdt het overzicht.",
  "card2_link_label": "Ontvang prijsindicatie",
  "card3_url": "https://trustoo.nl/nederland/keukenrenovatie/?utm_source=brevo&utm_campaign=crosssell_elektricien_mail1&utm_medium=email&utm_content=keukenrenovatiecard",
  "card3_image_url": "https://img.mailinblue.com/9986607/images/rnb/original/6aaa43a80b0c510d795d8950.jpg",
  "card3_image_alt": "Keukenspecialist aan het werk: keukenontwerp bespreken met een klant",
  "card3_label": "Verbouwen",
  "card3_name": "Keukenspecialisten",
  "card3_text": "Nieuwe keuken of je huidige keuken opknappen? Van ontwerp tot montage geregeld door een specialist.",
  "card3_link_label": "Ontvang prijsindicatie",
  "card4_url": "https://trustoo.nl/nederland/badkamer-renovatie/?utm_source=brevo&utm_campaign=crosssell_elektricien_mail1&utm_medium=email&utm_content=badkamerrenovatiecard",
  "card4_image_url": "https://img.mailinblue.com/9986607/images/rnb/original/6a99ca58acfba11dfcf1877f.jpg",
  "card4_image_alt": "Badkamerspecialist aan het werk: tegels plaatsen tijdens renovatie",
  "card4_label": "Verbouwen",
  "card4_name": "Badkamerspecialisten",
  "card4_text": "Een nieuwe badkamer van ontwerp tot oplevering, inclusief leidingwerk, tegels en de afwerking.",
  "card4_link_label": "Ontvang prijsindicatie",
  "closing_heading_pre": "Iets anders",
  "closing_heading_accent": "nodig?",
  "closing_heading_post": "",
  "closing_intro": "Op Trustoo vind je vakmensen voor bijna elke klus in en om het huis, en voor zakelijke en persoonlijke hulp. Vergelijk beoordelingen en ontvang gratis een prijsindicatie.",
  "all_services_url": "https://trustoo.nl/alle-diensten/?utm_source=brevo&utm_campaign=crosssell_elektricien_mail1&utm_medium=email&utm_content=allediensten",
  "all_services_label": "Alle diensten bekijken",
  "dashboard_label": "Mijn aanvragen"
}
